{
  "$schema": "https://raccioly.github.io/docguard/schemas/docguard-benchmark-baseline.schema.json",
  "schemaVersion": 2,
  "review": {
    "status": "reviewed",
    "reviewedAt": "2026-09-18",
    "reviewer": "DocGuard maintainers",
    "scope": "Thirteen exact defect/control pairs across eight synthetic and five pinned public repository groups. The architecture validator gains its first measured evidence: a three-layer Python package whose defect makes the route layer import the model layer directly, bypassing the declared service boundary. One Python architecture case is checked by the analyzer and remains classified unsupported_syntax, excluded from accuracy ratios: its fixture is a dynamic import (import_module(get_plugin_name())), which the analyzer’s own applicability reason places outside scope, and it has no paired defect, so scoring it as a clean control would credit a blind spot as evidence.",
    "methodology": "Labels were authored from pinned source and seeded mutations before DocGuard output was reviewed. The ARC001 Python layer-boundary pair added on 2026-09-18 was authored labels-first: the fixture and its expected/forbidden identities were committed before the corpus was run, and both cases matched their authored labels on the first run.",
    "limitations": "Finite scoped cases do not establish exhaustive documentation or detector correctness. Seven of the tool’s finding codes are measured here; the rest carry no benchmark evidence. ARC001 is measured by a single defect/control pair in one repository group, so its point estimate is below the reporting floor and it backs off to the whole-corpus tier.",
    "measures": "benchmark-precision",
    "caveat": "Benchmark precision on a deliberately balanced corpus of 13 defect and 13 clean-control cases across 13 repository groups and 13 causal families. This is DocGuard's precision on labelled cases, not the probability that a finding in your repository is real; quote every ratio with its n and Wilson 95% bound."
  },
  "core": {
    "schemaVersion": 1,
    "manifestDigest": "sha256:ac1b1677d3e570f5917ffa9c903a48a8ec5b88fbae5e99bd93b41836b282e6c7",
    "tool": {
      "version": "0.41.7",
      "revision": "ae9883c50a2ab432f220590fd6eb98b3d9a3def6"
    },
    "cases": [
      {
        "id": "dev-generated-security-control",
        "split": "development",
        "repositoryGroup": "synthetic-generated-security",
        "causalFamily": "generated-directory-exclusion",
        "parserTier": "js-ast",
        "classification": "clean_control",
        "repairOutcome": "not_evaluated",
        "sourceRevision": "sha256:09d16254c9bd0d0ae4c2be8f6b88a53f0f138d1029b433d02bcf76688b968fcb",
        "configDigest": "sha256:09adbc023d8d015085e20316b9cff66f95f9069ed0b17c00ccd977ec0525c322",
        "scope": {
          "validatorKey": "security",
          "codes": [
            "SEC001"
          ]
        },
        "expected": [],
        "forbidden": [
          "SEC001@src/generated-client/config.js"
        ],
        "actual": [],
        "unexpected": [],
        "missing": [],
        "forbiddenObserved": [],
        "abstained": false,
        "applicability": {
          "status": "checked",
          "reason": "Completed the declared checks; this does not establish exhaustive language, framework, or semantic coverage."
        },
        "checkCoverage": {
          "status": "warn",
          "passed": 1,
          "total": 1,
          "quality": "MEDIUM"
        },
        "commandStatus": "FAIL",
        "status": "PASS"
      },
      {
        "id": "dev-generated-security-defect",
        "split": "development",
        "repositoryGroup": "synthetic-generated-security",
        "causalFamily": "generated-directory-exclusion",
        "parserTier": "js-ast",
        "classification": "defect",
        "repairOutcome": "not_evaluated",
        "sourceRevision": "sha256:09d16254c9bd0d0ae4c2be8f6b88a53f0f138d1029b433d02bcf76688b968fcb",
        "configDigest": "sha256:09adbc023d8d015085e20316b9cff66f95f9069ed0b17c00ccd977ec0525c322",
        "scope": {
          "validatorKey": "security",
          "codes": [
            "SEC001"
          ]
        },
        "expected": [
          "SEC001@src/generated-client/config.js"
        ],
        "forbidden": [],
        "actual": [
          "SEC001@src/generated-client/config.js"
        ],
        "unexpected": [],
        "missing": [],
        "forbiddenObserved": [],
        "abstained": false,
        "applicability": {
          "status": "checked",
          "reason": "Completed the declared checks; this does not establish exhaustive language, framework, or semantic coverage."
        },
        "checkCoverage": {
          "status": "fail",
          "passed": 1,
          "total": 2,
          "quality": "LOW"
        },
        "commandStatus": "FAIL",
        "status": "PASS"
      },
      {
        "id": "dev-go-todo-control",
        "split": "development",
        "repositoryGroup": "synthetic-go-todo",
        "causalFamily": "tracked-go-todo",
        "parserTier": "fallback-language",
        "classification": "clean_control",
        "repairOutcome": "not_evaluated",
        "sourceRevision": "sha256:4e6000bd805ce227cb1cdbc467cf5a3269acdfade3ee989949742e41ea2c1fc2",
        "configDigest": "sha256:0c8b20776323b1022dfd7b9bf17f6a7132dd041ccea88ae2116d0586859a8462",
        "scope": {
          "validatorKey": "todoTracking",
          "codes": [
            "TDO002"
          ]
        },
        "expected": [],
        "forbidden": [
          "TDO002@app.go"
        ],
        "actual": [],
        "unexpected": [],
        "missing": [],
        "forbiddenObserved": [],
        "abstained": false,
        "applicability": {
          "status": "checked",
          "reason": "Completed the declared checks; this does not establish exhaustive language, framework, or semantic coverage."
        },
        "checkCoverage": {
          "status": "pass",
          "passed": 1,
          "total": 1,
          "quality": "HIGH"
        },
        "commandStatus": "FAIL",
        "status": "PASS"
      },
      {
        "id": "dev-go-todo-defect",
        "split": "development",
        "repositoryGroup": "synthetic-go-todo",
        "causalFamily": "tracked-go-todo",
        "parserTier": "fallback-language",
        "classification": "defect",
        "repairOutcome": "not_evaluated",
        "sourceRevision": "sha256:4e6000bd805ce227cb1cdbc467cf5a3269acdfade3ee989949742e41ea2c1fc2",
        "configDigest": "sha256:0c8b20776323b1022dfd7b9bf17f6a7132dd041ccea88ae2116d0586859a8462",
        "scope": {
          "validatorKey": "todoTracking",
          "codes": [
            "TDO002"
          ]
        },
        "expected": [
          "TDO002@app.go"
        ],
        "forbidden": [],
        "actual": [
          "TDO002@app.go"
        ],
        "unexpected": [],
        "missing": [],
        "forbiddenObserved": [],
        "abstained": false,
        "applicability": {
          "status": "checked",
          "reason": "Completed the declared checks; this does not establish exhaustive language, framework, or semantic coverage."
        },
        "checkCoverage": {
          "status": "warn",
          "passed": 0,
          "total": 1,
          "quality": "MEDIUM"
        },
        "commandStatus": "FAIL",
        "status": "PASS"
      },
      {
        "id": "dev-js-security-control",
        "split": "development",
        "repositoryGroup": "synthetic-js-security",
        "causalFamily": "hardcoded-password-assignment",
        "parserTier": "js-ast",
        "classification": "clean_control",
        "repairOutcome": "not_evaluated",
        "sourceRevision": "sha256:7839fae85ea03a2ed8889659bddefe20d28acfa896a69ade16da6854410f49a6",
        "configDigest": "sha256:09adbc023d8d015085e20316b9cff66f95f9069ed0b17c00ccd977ec0525c322",
        "scope": {
          "validatorKey": "security",
          "codes": [
            "SEC001"
          ]
        },
        "expected": [],
        "forbidden": [
          "SEC001@src/config.js"
        ],
        "actual": [],
        "unexpected": [],
        "missing": [],
        "forbiddenObserved": [],
        "abstained": false,
        "applicability": {
          "status": "checked",
          "reason": "Completed the declared checks; this does not establish exhaustive language, framework, or semantic coverage."
        },
        "checkCoverage": {
          "status": "warn",
          "passed": 1,
          "total": 2,
          "quality": "MEDIUM"
        },
        "commandStatus": "FAIL",
        "status": "PASS"
      },
      {
        "id": "dev-js-security-defect",
        "split": "development",
        "repositoryGroup": "synthetic-js-security",
        "causalFamily": "hardcoded-password-assignment",
        "parserTier": "js-ast",
        "classification": "defect",
        "repairOutcome": "not_evaluated",
        "sourceRevision": "sha256:7839fae85ea03a2ed8889659bddefe20d28acfa896a69ade16da6854410f49a6",
        "configDigest": "sha256:09adbc023d8d015085e20316b9cff66f95f9069ed0b17c00ccd977ec0525c322",
        "scope": {
          "validatorKey": "security",
          "codes": [
            "SEC001"
          ]
        },
        "expected": [
          "SEC001@src/config.js"
        ],
        "forbidden": [],
        "actual": [
          "SEC001@src/config.js"
        ],
        "unexpected": [],
        "missing": [],
        "forbiddenObserved": [],
        "abstained": false,
        "applicability": {
          "status": "checked",
          "reason": "Completed the declared checks; this does not establish exhaustive language, framework, or semantic coverage."
        },
        "checkCoverage": {
          "status": "fail",
          "passed": 0,
          "total": 2,
          "quality": "LOW"
        },
        "commandStatus": "FAIL",
        "status": "PASS"
      },
      {